attempt	commit	window_id	result_dir	window_start	window_end	window_days	symbol_count	score	raw_net_return	trade_count	status	description	run_kind	candidate_score	recent_mean_score	worst_recent_score	passed_window_count	failed_window_count	promotion_decision	promotion_score	score_dispersion	cost_stress_score	cost_stress_ratio	rotating_probe_window_id	rotating_probe_score	promoted_commit
24	4ac5d5b	validation_2025_h1	results/next50_crypto_perp_autoresearch_ensemble/2026-05-27T182654Z-crypto_perp_autoresearch_ensemble	2025-01-01	2025-06-29	180	3	0.0006650483565624082	0.11970870418123347	656	discard	fixed guard: ADA concentration ceiling 95 025 025 allocation	diagnostic													
25	4ac5d5b	validation_2025_h2	results/next50_crypto_perp_autoresearch_ensemble/2026-05-27T182826Z-crypto_perp_autoresearch_ensemble	2025-07-01	2025-12-27	180	3	0.0007899524088638117	0.1421914335954861	618	discard	diagnostic: ADA concentration ceiling 95 025 025 allocation H2	diagnostic													
26	4ac5d5b	locked_recent_2026	results/next50_crypto_perp_autoresearch_ensemble/promotion_0026_crypto_perp_autoresearch_ensemble	2025-10-16	2026-04-13	180	3	0.0010592972561262468	0.19067350610272443	661	promote	promote candidate: ADA concentration ceiling 95 025 025 allocation	promotion						promote	0.0008572886206794205	0.00013467242363121752	0.001009786145015136	1.0921036397976738	validation_2025_h1	0.0006650483565624082	4ac5d5b
27	4ac5d5b	locked_recent_2026	results/next50_crypto_perp_autoresearch_ensemble/2026-05-27T183630Z-crypto_perp_autoresearch_ensemble	2025-10-16	2026-04-13	180	3	0.00076967488764556	0.1385414797762008	639	discard	next50 soft RSI exhaustion filter short threshold 20	explore													
28	4ac5d5b	locked_recent_2026	results/next50_crypto_perp_autoresearch_ensemble/2026-05-27T183812Z-crypto_perp_autoresearch_ensemble	2025-10-16	2026-04-13	180	3	0.0009900450426131786	0.17820810767037212	655	discard	next50 extreme RSI exhaustion filter short threshold 10	explore													
29	4ac5d5b	locked_recent_2026	results/next50_crypto_perp_autoresearch_ensemble/2026-05-27T184001Z-crypto_perp_autoresearch_ensemble	2025-10-16	2026-04-13	180	3	0.0010705250433796299	0.1926945078083334	661	keep	next50 exclude negative decision hour 17	explore													
30	4ac5d5b	validation_2025_h1	results/next50_crypto_perp_autoresearch_ensemble/2026-05-27T184137Z-crypto_perp_autoresearch_ensemble	2025-01-01	2025-06-29	180	3	0.0006254068202368694	0.1125732276426365	653	discard	fixed guard: exclude negative decision hour 17	diagnostic													
31	4ac5d5b	locked_recent_2026	results/next50_crypto_perp_autoresearch_ensemble/2026-05-27T184317Z-crypto_perp_autoresearch_ensemble	2025-10-16	2026-04-13	180	3	0.0010361785548517457	0.18651213987331425	661	discard	next50 exclude negative decision hour 19	explore													
32	4ac5d5b	locked_recent_2026	results/next50_crypto_perp_autoresearch_ensemble/2026-05-27T184457Z-crypto_perp_autoresearch_ensemble	2025-10-16	2026-04-13	180	3	0.001092129284425893	0.19658327119666075	657	keep	next50 exclude negative decision hour 20	explore													
33	4ac5d5b	validation_2025_h1	results/next50_crypto_perp_autoresearch_ensemble/2026-05-27T184629Z-crypto_perp_autoresearch_ensemble	2025-01-01	2025-06-29	180	3	0.0006617318996704307	0.11911174194067753	649	discard	fixed guard: exclude negative decision hour 20	diagnostic													
34	4ac5d5b	validation_2025_h2	results/next50_crypto_perp_autoresearch_ensemble/2026-05-27T184801Z-crypto_perp_autoresearch_ensemble	2025-07-01	2025-12-27	180	3	0.000842500452520825	0.1516500814537485	616	discard	diagnostic: exclude negative decision hour 20 H2	diagnostic													
35	4ac5d5b	locked_recent_2026	results/next50_crypto_perp_autoresearch_ensemble/promotion_0035_crypto_perp_autoresearch_ensemble	2025-10-16	2026-04-13	180	3	0.001092129284425893	0.19658327119666075	657	promote	promote candidate: exclude negative decision hour 20	promotion						promote	0.0009049076604970921	0.00012481441595253403	0.0010428459510925597	1.078083243709885	validation_2025_h1	0.0006617318996704307	4ac5d5b
36	4ac5d5b	locked_recent_2026	results/next50_crypto_perp_autoresearch_ensemble/2026-05-27T185536Z-crypto_perp_autoresearch_ensemble	2025-10-16	2026-04-13	180	3	0.0011352896180580805	0.20435213125045448	655	keep	next50 stack exclusions hours 17 and 20	explore													
37	4ac5d5b	validation_2025_h1	results/next50_crypto_perp_autoresearch_ensemble/2026-05-27T185712Z-crypto_perp_autoresearch_ensemble	2025-01-01	2025-06-29	180	3	0.000622090363344892	0.11197626540208055	646	discard	fixed guard: stack exclusions hours 17 and 20	diagnostic													
38	4ac5d5b	locked_recent_2026	results/next50_crypto_perp_autoresearch_ensemble/2026-05-27T185848Z-crypto_perp_autoresearch_ensemble	2025-10-16	2026-04-13	180	3	0.0010838582959953776	0.19509449327916795	652	discard	next50 stack exclusions hours 19 and 20	explore													
39	4ac5d5b	locked_recent_2026	results/next50_crypto_perp_autoresearch_ensemble/2026-05-27T190028Z-crypto_perp_autoresearch_ensemble	2025-10-16	2026-04-13	180	3	0.0011613915909232705	0.2090504863661887	652	keep	next50 stack exclusions hours 08 and 20	explore													
40	4ac5d5b	validation_2025_h1	results/next50_crypto_perp_autoresearch_ensemble/2026-05-27T190202Z-crypto_perp_autoresearch_ensemble	2025-01-01	2025-06-29	180	3	0.00017751425876853542	0.031952566578336374	646	discard	fixed guard: stack exclusions hours 08 and 20	diagnostic													
41	4ac5d5b	locked_recent_2026	results/next50_crypto_perp_autoresearch_ensemble/2026-05-27T190354Z-crypto_perp_autoresearch_ensemble	2025-10-16	2026-04-13	180	3	0.00042973970250861974	0.07735314645155156	520	discard	next50 high conviction require five votes	explore													
42	4ac5d5b	locked_recent_2026	results/next50_crypto_perp_autoresearch_ensemble/2026-05-27T190534Z-crypto_perp_autoresearch_ensemble	2025-10-16	2026-04-13	180	3	0.0011463901596559236	0.20635022873806627	657	discard	next50 tighter ATR stop multiplier 4	explore													
43	4ac5d5b	validation_2025_h1	results/next50_crypto_perp_autoresearch_ensemble/2026-05-27T190709Z-crypto_perp_autoresearch_ensemble	2025-01-01	2025-06-29	180	3	0.0005099644920730558	0.09179360857315004	649	discard	fixed guard: tighter ATR stop multiplier 4	diagnostic													
44	4ac5d5b	locked_recent_2026	results/next50_crypto_perp_autoresearch_ensemble/2026-05-27T190848Z-crypto_perp_autoresearch_ensemble	2025-10-16	2026-04-13	180	3	0.001077238108859354	0.1939028595946837	657	discard	next50 wider ATR stop multiplier 7	explore													
45	4ac5d5b	locked_recent_2026	results/next50_crypto_perp_autoresearch_ensemble/2026-05-27T191034Z-crypto_perp_autoresearch_ensemble	2025-10-16	2026-04-13	180	3	0.0005728915637801669	0.10312048148043006	847	discard	next50 shorter max hold 480 bars	explore													
46	4ac5d5b	locked_recent_2026	results/next50_crypto_perp_autoresearch_ensemble/2026-05-27T191217Z-crypto_perp_autoresearch_ensemble	2025-10-16	2026-04-13	180	3	0.0006916748863909944	0.124501479550379	550	discard	next50 longer max hold 960 bars	explore													
47	4ac5d5b	locked_recent_2026	results/next50_crypto_perp_autoresearch_ensemble/2026-05-27T191407Z-crypto_perp_autoresearch_ensemble	2025-10-16	2026-04-13	180	3	0.0010769267900196439	0.19384682220353588	650	discard	next50 lower dynamic threshold vol weight 0.3	explore													
48	4ac5d5b	locked_recent_2026	results/next50_crypto_perp_autoresearch_ensemble/2026-05-27T191546Z-crypto_perp_autoresearch_ensemble	2025-10-16	2026-04-13	180	3	0.001168801413730502	0.21038425447149037	669	keep	next50 higher dynamic threshold vol weight 0.7	explore													
49	4ac5d5b	locked_recent_2026	results/next50_crypto_perp_autoresearch_ensemble/promotion_0049_crypto_perp_autoresearch_ensemble	2025-10-16	2026-04-13	180	3	0.001168801413730502	0.21038425447149037	669	reject	promote candidate: higher dynamic threshold vol weight 0.7	promotion						reject	0.0008506036183809982	0.0002121318635663359	0.0011188347470638355	1.1695101478580996	validation_2025_h1	0.0006313792099020191	
50	4ac5d5b	locked_recent_2026	results/next50_crypto_perp_autoresearch_ensemble/2026-05-27T192352Z-crypto_perp_autoresearch_ensemble	2025-10-16	2026-04-13	180	3	0.0011136657665625073	0.2004598379812513	660	discard	next50 upstream bb percentile threshold 90	explore													
